Автор ='publicist', Название ='Мы верим, что есть свобода пока жива мечта', Рецензия ='«Побег из Шоушенка». И как досталась такая слава? У меня зубы сводит от непонимания данной ситуации. Да я и отказываюсь что-либо понимать в данном кинематографическом русле. Имеющий глаза, да увидит и поймёт «корневище» ситуации. И пусть у неприятелей зубы искрошатся в пыль, но моё мнение останется непреложным. Задуматься, думаю, стоит каждому: На современные блокбастеры, хорроры, арт-хаусы, да даже драм-триллеры инвестируются баснословные вливания. В своём большинстве, вышедшие из-под «пера» картины «отбивают» все потраченные на создание самое себя средства стократ. И ленты эти выходят (в смысле, «получаются») громкими, звонкими и знаменитыми. Само собой, история «Побега» тоже знаменитая лента режиссёра Фрэнка Дарабонта (на ту пору – почти дебютная). Я о принципе! Чтобы сделать моё заявление ещё более прозрачным, нужно понять что я имею в виду: Чем «Шоушенк» заслужил первое место в рейтинге больше, чем, скажем, «Начало», «Аватар» и иже с ними? Нет, само собой, и как фильм «Шоушенк» не плох, и мысль своя в нём присутствует. Но, по мне, так он не тянет даже на то, чтоб быть и находится в первой десятке рейтинга IMDb. Просто средний и ничем не выразительный фильм. И вот этот невыразительный фильм плотно уселся на пьедестале почёта и, что САМОЕ ПОРАЗИТЕЛЬНОЕ – выходящие время от времени, поистине превосходные произведения не могут сравниться с «непревзойдённым» «Побегом из Шоушенка» (почувствуйте, как говориться, сарказм). Плюсы фильма можно перечислить в одно предложение: Это мораль о свободе, вере и надежде. Основная мысль: свободным можно оставаться и будучи в неволе. Всё. Минусы. Их больше. Это какая-то невероятная затянутось ленты. Казалось, «Шоушенк» никогда не закончится. Чувствуется отсутствие реалистичности происходящего. Это нужно вынести в отдельный абзац… Стоит посмотреть любой другой фильм про американскую тюрьму и каждый поймёт, что нужно быть очень невнимательным, чтобы не обнаружить очевидного: Отношение к этнической группе населения особенно у заключённых тех лет было, мягко говоря, не таким, чтобы делать темнокожего, пожалуй, самым крутым в тюрьме. Просто у Стивена Кинга Рэд был ирландец, а у Дарабонта стал афро-америцанец. Последнее, чем хотелось бы пожурить эту картину – это издевательским отношением к процессу старения. А точнее к его отсутствию. Это ж надо было так проигнорировать сей момент. Или просто «париться» не захотели в уверенности, что пипл и так схавает? Но не всё так мрачно в «Побеге из Шоушенка». Как уже в миллионный раз сказано, он о свете в конце тоннеля. Энди Дюфрейн – олицетворение жизни. Он что героиня Островского – луч света в тёмном царстве. И вот наш «граф Монте-Кристо», безвинно осуждённый задумывает побег. Просит своего тюремного друга добыть ему маленькую кирку. И в течении 2-х десятилетий наш герой… наращивает авторитет. И у соратников-заключённых («сёстры» уже не мешали), и у работников административного корпуса. Тут можно закрыть глаза на ирреальность событий. Хотя, может, в американской тюрьме действительно райские кущи. Смысл в другом. Садясь смотреть «Побег», я ожидал лицезреть побег! А у нас на экране вместо него какая-то тюремная тягомотина. Раскрою секрет: Самому побегу уделено где-то 2,5 минуты экранного времени. Но фильм хорош. Просто, не надо, судя по всему, умничать, а надо просто уловить волну. Однако, хоть режьте меня, я твердокаменно убеждён: «Шоушенку» давно пора уступить золотой пьедестал. И не надо здесь говорить о том, что зрительские симпатии распределились не на визуальные эффекты создателей кино, но на душевные «костёрные» байки. «Золото» досталось «Шоушенку» за «красивые глаза»! И точка. 6 из 10 Хватит петь бесконечные неесные дифирамбы и слагать ломаносовские оды. Возвращайтесь к реальности. Есть фильмы поинтереснее и в этом самом жанре в каком и пресловутый 'Побег из Шоушенка'...', Оценка =NEUTRAL
Автор ='Gerc0g', Название ='Разум и сердце', Рецензия ='Настал день, когда я решился написать рецензию на 'Побег из Шоушенка'! 'Побег из Шоушенка' фильм безусловно выдающийся. Он назнимает первое место и на кинопоиске, и на IMDB. Причем время идет, но Шоушенк ниже не опускается. Меняются времена, меняются ценности, но фильм снятый в довольно далеком 1994 году остается самым лучшим. 'Побег из Шоушенка' фильм безусловно выдающийся. В каком-то смысле даже совершенный. Работа режиссера, игра актеров, сценарий - все безукоризненно. И все же я недолюбливаю этот фильм. Вернее я не считаю, что это фильм идеален и он заслуживает 1 место. Почему? Об этом ниже, но сначала немного размышлений. Муж с женой в Мексике прожили в браке 89 лет. Без крупных ссор. Без расставаний. Без взаимных упреков. И спустя столько лет они не надоели друг другу. Любовь? Любовь - понятие идеальное, был брак идеален? Доверие, взаимное уважение, одинаковые приоритеты и жизненные ценности, трепетное отношение к супругу и многое другое. Брак совершенен. А любовь? Наверное она потухла. Ведь не было ссор, не было страстей, не было эмоций. А без нее нельзя говорить о любви. По крайней мере идеальной. Один эгоист очень любил себя. Он восхищался своим умом, красотой, талантами. Он знал, что у него множество недостатков, но продолжал любить себя. Горячо и самозабвенно. К чему все это? Для меня идеальный мир это набор и преимуществ, и недостатков. Просто недостатки должны быть в тени плюсов. А фильм 'Побег из Шоушенка' безгрешен как чета мексиканцев. Фильм снят по роману Стивена Кинга. И надо заметить, не самого его лучшего. Если сделать опрос среди поклонников его творчества лишь единицы назовут его любимым. А фильм снятый по нему является лучшим. И если сделать опрос среди киноманов, единицы назовут 'Побег...' любимым фильмом. Парадокс? Отнюдь. Один композитор был одарен талантом от Бога. У него был врожденный дар. И он писал невероятно красивую музыку. Но критики иногда его журили, а зрители не могли зевнуть на концерте. Потому что музыка завораживала. Хотя они знали, что недостатки имеются. Был один музыкант. Он долго и кровопотливо изучал нотную грамоту и осваивал инструменты. Он тоже писал музыку. А критики не могли придраться. Потому что он знал, что 'правильно', а что нет. Но зрители иногда зевали. К чему я это? 'Побег из Шоушенка' снят отличным режиссером. Но есть режиссеры гораздо именитей и главное талантливей. Но Дарабонт знал, как оценивают фильмы кинокритики. И не было слабых мест. Режиссер был трудолюбивым. Усердным. Он много работал и успех был. Бертон, Ханэке, Бергман, Риччи и другие. Они талантливы. Они отмечены печатью небес. Но у них были слабые места. И поэтому их фильмам не суждено быть первыми... Талант это символ души. Трудолюбие это символ сознания. Так, что важнее и лучше: творить сердцем или умом? p.s Можно долго спорить можно ли добиться успеха без трудолюбия? Мой ответ да!', Оценка =NEUTRAL
Автор ='СВОЙ', Название ='', Рецензия ='У каждого человека есть свои ценности. Кто-то ни дня не может прожить без фотосъемки. Кто-то работает на любимой ему работе. Кому-то нравится читать книги, или смотреть фильмы, слушать музыку. У всех свои. Но чтобы эти ценности оставались для человека нужными и ценными — ему нужна свобода. Без нее хочется все бросить и ничего не делать, ничем не заниматься. Даже любимыми делами. 'Побег из Шоушенка' — фильм о человеке, который не бросил свои ценности. Не поддался на провокацию неволи. Который пытался, даже в такой обстановке, изменить себя и окружающий его мир к лучшему. О человеке, который рискует ради свободы. Таких стоит уважать. Но что самое главное — о человеке с работающей головой. И упорством. И терпением. А такие люди в любой ситуации выиграют. И пусть даже только для себя. А в данном случае, пожалуй, для многих. Фильм можно смотреть много раз. Но самый главный — первый. Потому что первый раз он больше всего захватывает. Фильм, снятый в таком жанре, особенно захватывать не должен. Но этот... Отдельный случай. И во второй, и в десятый раз он будет захватывать. Но первый раз незабываем. Причем захватывает фильм не только сюжетом. Но и игрой актеров. Такая добрая улыбка действующих лиц, узников Шоушенка, что хочется верить, что они и вправду ничего не делали. Такие реальные эмоции, что хочется верить, что они действительно отбывают свой пожизненный срок. Такое наглое лицо капитана и директора, что смотришь, и ненавидишь их вместе с заключенными. Единственное, что я для себя отметил, — что любимым этому фильму стать сложно. Не знаю почему. Он и человечный, и о ценностях, и снят замечательно. Но, почему-то он стоит где то в середине. Не худший из лучших. Не лучший из худших. Просто в середине.', Оценка =NEUTRAL
Автор ='Chaosmaster', Название ='', Рецензия ='Интересно рассказанная история с несколько наивной концовкой. Фильм называют шедевральным, но, честно признаться, я эту шедевральность не почувствовала. Фильмов о тюремной жизни очень много, и «Шоушенк» отличается лишь тем, что здесь реалии этой жизни очень смягчены, а чудеса преувеличены. Наверное, это потому, что фильм снят по книге Стивена Кинга, который, хоть и любит «тюремную» тему, а всё равно по своей сути является писателем-фантастом. Практика же показывает, что художественность и тюрьма не очень сочетаются. Тут уж, как говорится, или-или. Посему поверить в происходящее очень трудно и задуматься, в принципе, не над чем. Мы просто наблюдаем за происходящими событиями, которые плавно и интересно нам подаёт на блюдечке режиссёр. На актёров смотреть приятно, но ничего большего фильм в себе не таит. 5 из 10', Оценка =NEUTRAL
Автор ='Орк-наемник', Название ='68%', Рецензия ='Если вы не читали книгу, фильм вам понравится. Забавное вступление, правда?Поймите меня правильно, я не их тех, кто любит утверждать, что книга всегда лучше фильма, и придираться к каждой нестыковке в сюжете. Сам фильм, в общем-то, хорош, но есть ряд нюансов, сильно портящих впечатление. Первый - это Фримен. Престарелый афроамериканец вместо разбитного ирландца, пусть и так же в годах, - без комментариев. Трусливый аморфный парень никогда не стал бы в тюрьме 'человеком, который может достать всё'.У Фримена других ролей и не бывает, он везде одинаков и даже в 'Последних рыцарях' его гордый дворянин выглядел трусом, из крайних сил прячущим свою слабость. Второй - сам Тим Роббинс. Он так же похож на уверенного в себе парня из оригинала, который, несмотря на стычки с 'сестрами' и все остальные проблемы, не утратил чувство достоинства и всегда смотрит на всех чуть свысока, как Фримен на ирландца. Здесь особенно противна сцена на крыше, в которой парень трясется и лепечет, как ребенок. Хотя в оригинале он был само спокойствие. Этому парню в таком фильме не место. И третий - всеобщая вялость. Такое ощущение, будто люди на курорте, а не в строгой тюрьме. Все только и делают, что шутят, улыбаются, заигрывают с охраной. Фримен без шутки слова не скажет. Это было бы простительно ирландцу. Настоящему ирландцу. И сцена с избиением новичка нисколько не прибавляет атмосфере мрачности. Фильм почти комедия, а комедией он быть не должен. Что действительно понравилось, так это охранники. Очень подходяще подобраны. По стобалльной шкале выставлю этому фильму 68 баллов и скажу так:годится смотреть раз в несколько лет, не чаще.', Оценка =NEUTRAL
Автор ='Несносный Шон', Название ='Сладкая история свободы', Рецензия ='Первый раз я посмотрел Шоушенк лет 5 назад, мне было 18 или около того. Тогда мне фильм безусловно понравился и входил в мой личный TOP, но пришло время пересматривать старые шедевры и мое мнение изменилось. Возможно, то что 2+ часа мне показались 4мя специальный прием режиссера, призванный показать тягучесть времени проведенного в тюрьме. Но что-то мне подсказывает, что это была скука. И все по одной простой причине - роман Кинга так и остался романом. Если убрать закадровый голос Реда, фильм тут же развалится на части. Я не против рассказчика в фильме, если история самодостаточна, а голос является приятным бонусом, придающим определенную эмоциональную окраску происходящим событиям. Но не когда этот голос меня ведет, пытаясь скрыть ляпы и доказывая мотивацию главного героя. Поэкспериментируйте - выключите экран и послушайте фильм. И вы ничего не потеряете, все герои вежливо представляются и объясняют свои поступки, а если вы что то недопоняли, Ред вам разжует. Это неуважение к зрителю. Фильм явно адресован широкой аудитории, где Энди безоговорочно должен нам понравиться. Но если в надуманную историю несправедливо осужденного банкира, который со всеми своими возможностями не смог добиться справедливого суда ещё можно поверить. То сцены несвершившегося насилия кучкой местных педиков, явно призваны защитить любовь зрителя к персонажу. Они смущают своей неправдоподобностью, зато накрашенные девочки по прежнему сидят на своих местах в кинозале и верят что мир прекрасен. В этом плане 'Полуночный экспресс' вышедший в 1978 является противоположностью Шоушенку и возможно даже стал источником вдохновения для Кинга. И вообще в фильме очень много внешних приемов, к примеру, когда ребята смолили крышу, Энди пошел как зомби по крыше, не реагируя на слова своих товарищей, чтобы раскрыть свой план отмывания денег надзирателю. При этом, ради драматизма сцены рискуя своим здоровьем, хотя все можно было сделать гораздо проще. Возможно таких моментов было бы меньше если авторы адаптируя сценарий потрудились так же, как авторы 'Кукушкиного гнезда'. Ведь в оригинале там тоже повествование ведется от лица второстепенного героя. И им удалось создать фильм используя киноязык. Еще можно привести множество неудобных моментов, но тут без спойлеров не обойтись. Актерскую игру нельзя назвать выдающейся, у них толком не было подтекста, который можно сыграть, Ред все сказал и так. Но меня растрогала сцена, когда Ред выступал третий раз перед комиссией, она была самой правдивой в фильме. Камера показалось мне суховатой, монтаж и музыка работают на историю, но как-то не обращены к чувствам. Хороший фильм, простой для понимания, но не шедевр и не номер один. Проблемы свободы, дружбы, несправедливости не так просты и однозначны, как они показаны в этом фильме. 7 из 10', Оценка =NEUTRAL
