Автор ='1985', Название ='', Рецензия ='Фильм действительно феноменален и гениален, но его феноменальность и гениальность, по-моему, прежде всего состоит в идее, которая пронходит через весь фильм. Это идея своего рода – тонкая нить, про которую нельзя никогда забывать. В этой идее отображены, по-моему, одни из самых главных вещей в мире: стремление к свободе (мечте), вера в себя и свои силы. Главный герой показывает, что никогда нельзя отчаиваться, как бы безнадежно не выглядела ситуация в которую ты попал (в этом, на мой взгляд, состоит бессмертность и современность, как фильма так и книги Стивена Кинга). Конечно нельзя не выделить актерскую игру Тима Роббинса и Моргана Фримана. Герой Роббинса не просто человек, которому удался побег из одной из самых неприступных тюрем (хотя это ему удалось с блеском!), он человек в своем роде бросивший вызов системе правосудия, которая, несмотря на всю свою якобы совершенность иногда допускает роковые ошибки и конечно же он тот, который показал, что даже за самыми крепкими и высокими стенами в неволе, можно чувствовать себя свободным человеком и быть таковым, насколько это возможно. Его персонаж, на первый выглядевший как «тюфяк», на самом деле оказывается очень сильной и цельной личностью, который не теряет веру в себя и способен сам управлять своей судьбой, и который не боится принимать решения и идти на поступки от которых зависит вся его дальнейшая судьба и жизнь. Очень характерно и то, что своей силой воли он заражает и других окружающих и общение с ним меняет людей навсегда. Морган Фриман играет же так называемого «тюремного человека», т.е. человека который большую часть своей жизни провел за решеткой. В тюрьме он значимая фигура, он может достать все, что вам необходимо; здесь у него авторитет и уважение. Несмотря на все это он все же мечтает о свободе (как наверное и каждый отбывающий срок человек), однако, с годами надежда потихоньку ускользает от него и с каждым собеседованием о досрочном освобождении он теряет ее (надежду) все больше и больше. С момента попадания в тюрьму Энди Дюфрейна (Т. Роббинса) и их знакомства, он начинает меняться – незаметно для окружающих и даже для себя самого, ведь эти изменения внутренние, своего рода душевные и мировоззренческие. Вообще, созданный Фриманом образ очень глубок и содержателен – очень характерны сцены переосмысления своей жизни и понимание своих ошибок прошлых лет, собственно те из-за которых он и попал сюда. Также нельзя не отметить его голос за кадром, комментирующий всю историю. Очень выразительны и великолепны фразы в конце фильма (не буду раскрывать, кто захочет, тот посмотрит, и надеюсь, также оценит).', Оценка =NEUTRAL
Автор ='God of emptiness', Название ='', Рецензия ='Такое ощущение как будто я сам отсидел в Шоушенке. Это чувство не покидало меня, когда фильм пересек середину своего хронометража. Фильм всего идет 2:20, но из-за размеренности, неторопливости фильм лично мне показался очень долгим. Отсутствие резких моментов, помимо драк, которые там были, фильм по-черепашьи крадется к своему логическому завершению. Но не это главное в этом фильме. История совершенно о другом. Если вспомнить то практически все фильмы на тюремную тематику несут с собой выяснение кто на зоне хозяин, интрига, стычки и.т.д. «Побег из Шоушенка» это нечто другое. Это фильм о человеческих судьбах, о дружбе, о том, как остаться человеком, надежде. Зрителя не может не тронуть история настоящей дружбы. Дружбы, которая завязалась в столь злачном месте как тюрьма. Дружба настолько светлая и преданная, что даже сидя у экрана, невольно задумываешься над тем, а такие же друзья окружают тебя. Фильм о надежде. Именно она дает нам силы на то что бы жить. Мы станем свидетелями как один человек, который не потерял надежду, дал ее своему самому дорогому человеку, который терял надежду вот уже сорок лет. Сам побег в фильме отходит на второй план, а возможно даже на третий. Мы, конечно, понимаем, что в итоге главный герой сбежит, и сбежит так дерзко, что Майкл Скофилд позавидует. Практически за весь фильм, кроме момента побега, о побеге даже речи не пойдет. От чего сам побег в конце подарит эмоциональный подъем у зрителя. На протяжении всего фильма особой интриги не наблюдается. Да и история в некотором смысле не правдоподобная. Все же это тюрьма, а тут зек вешает плакаты распутных девиц себе на стены в камере. Да и, в общем, свобода заключенного (главного героя) не передается объяснению. Да и бог с ним, если создатель видит фильм таким, значит нужно принять его, и смотреть таким, какой он есть. Фильм замечателен своей идеей, сценарием, актерской игрой. Рука не поднимется поставить ему ниже десяти.', Оценка =NEUTRAL
Автор ='Алёна', Название ='', Рецензия ='Стыд мне и позор! Я вчера посмотрела этот фильм первый раз. Почему я не видела его раньше? Не могу понять, как такое потрясающее кино прошло мимо меня :( Игра главных актеров просто изумляет и заставляет переживать вместе с ними... А проклятого начальника тюрьмы мне отчаянно хотелось превратить в крысу и наступить на него, чтоб и не пикнул даже! Кстати, он очень похож на крысу, такого вредного, опасного и малодушного создания... Тим Роббинс и Морган Фриман неподражаемы! Посмотрев этот фильм, понимаешь, как нужно дорожить свободой и всем тем, что дает тебе жизнь и не размениваться на алчность, предательство, мелочность и злость... "Побег из Шоушенка" учит тому, что прежде всего необходимо оставаться Человеком, куда бы не забросила тебя судьба и какие бы сюрпризы не проиподнесла! Браво режиссерам, актерам и конечно же Стивену Кингу, его произведения вечны!', Оценка =NEUTRAL
Автор ='Trokvedlu', Название ='Бороться всегда! Бороться за свободу!', Рецензия ='Первый раз я посмотрел этот фильм в 15 лет, тогда признаться я ничего не понял кроме того, конечно, что фильм очень серьезен (это я заметил по выражению лица своего отца, находившегося рядом). И вот, по прошествию одного года, я вновь увидел в ТВ-программе, среди кучи бессмысленных названий и букв, два знакомых слова, которые я жаждал увидеть целый год - 'Побег из Шоушенка'... И вот, когда лента Фрэнка Дарабонта наконец просмотрена мной, я понял какой ответ на вопрос, над которым думают и всегда думали Величайшие философы Земли - 'в чем же смысл жизни?' Этот фильм дает нам (зрителям) прекрасный ответ на этот философский вопрос - 'В ВЕЧНОЙ БОРЬБЕ И ИЗБАВЛЕНИИ'. Кратко о своих мыслях по поводу: Признаться, мне, вглядывающемуся в длинные титры после конца этого фильма, на ум приходили самые странные, а порой даже пугающие мысли... 'Побег из Шоушенка' - это история воина, рёнина (самурая без господина), история его борьбы за свободу, за собственную честь, за жизнь. Достаточно вспомнить отталкивающие моменты, когда главный герой через, простите, массу тюремного дерьма - метр за метром пробирается к свободе, к заветному тусклому свету ночного светила, утопающего где-то в бесконечных потоках серого дождя. Вот, на мой взгляд, важнейший момент всего фильма... PS 'Побег из Шоушенка' - воистину эпохальное творение, смотрите этот фильм. Ведь как ни какая другая кинолента, эта воспитывает людей, уча ценить то, что у Нас есть: любовь родных, любовь друзей, Нашу Честь, а главное Нашу Свободу.', Оценка =NEUTRAL
Автор ='Gretchen', Название ='Он не заплакал.', Рецензия ='Многие люди судят о фильме по названию. К сожалению, я тоже. 'Побег из Шоушенка'- наверняка там кто-то сбегает из тюрьмы, придумав неплохую комбинацию. В чём смысл? И как оказалось, иногда смысл в фильме далеко не главное. Да, звучит абсурдно, но подчас игра актёров, внутренний замысел фильма и передаваемые режиссёром чувства, приковывают вас к экрану сильнее, чем любой запутанный детектив или великолепная комедия. То, что несёт вместе с собой 'Побег из Шоушенка' практически ни с чем не сравнимо. Хотя что-то похожее есть в 'Зелёной миле'. Нет, этот фильме не о свободе, не о нравах, не о людях, не о событиях. Он о мечте...не о той, что сидит у нас в голове, и мы каждый день её себе представляем. Нет. Тут мечта иная, душевная мечта. У каждого человека есть любимый фильм. Но он не смотрит его каждый день, а просто любит, и знает это. 'Побег из Шоушенка' стал одним из моих любимых фильмов, но не самым. Но почему то именно его я готова смотреть хоть каждый день. Этому фильм не требует оценок. По оценкам судят, а его судить нельзя.', Оценка =NEUTRAL
Автор ='il brutto', Название ='Экзистенциальная драма', Рецензия ='Ни много, ни мало, но считать этот фильм менее великим уже кажется преступлением. «Побег из Шоушенка» (кстати, более глубокий и близкий к оригиналу перевод — «Искупление Шоушенком») – это квинтэссенция самых гениальных образов и замыслов, когда-либо существовавших в мире кинематографа. Фильм вобрал в себя абсолютно всё, начиная бытовой драмой и заканчивая психологическим анализом человеческой сущности и личности. Ленте было предначертано стать культовой. Фильм, полностью проигнорированный Американской киноакадемий, все же смог пробиться в ряды лучших из лучших, найдя признание у миллионов кинолюбителей. И не стоит говорить, что миллионы мух не могут ошибаться. Здесь абсолютно другая ситуация. Просто режиссеру ленты Френку Дарабонту случилось снять то, что смогли понять многие. Поэтому его ленте не стоить уходить в ряды арт-хауса, по причине «малого признания». Так же не стоит забывать о сценарии сего творения. Как говорил маэстро Хичкок: «В фильме должно быть три вещи: сценарий, сценарий и ещё раз сценарий». Небезызвестный автор мистических ужасов, чьи книги «подвергались» экранизации не менее 50 раз, Стивенг Кинг, предоставил для воплощения на экран свою гениальную драму о Настоящем Человеке. Можно смело заверить, что самых удачных и наиболее продуманных фильмов по его произведениям всего 3, которые уже стали незыблемой классикой. «Сияние» Стенли Кубрика и «Побег из Шоушенка», «Зеленая миля» режиссера Френка Дарабонта. Если первая лента, это интеллектуальный мистико-психологический фильм ужасов, то два других фильма это жанр «экзистенциальная драма» (можно ещё добавить ‘тюремная’). Конечно, можно ещё вспоминать, как в детстве нравилось «Оно», как недавно была выпущена довольно оригинальная «Мгла», но всё-таки из всего ряда экранизаций, «Побег из Шоушенка» лучшее, что было перенесено на экран. С ювелирной четкостью, Дарабонт поставил этот фильм, выбрав отличное место для съемок и хорошо прочувствовав стиль произведения и характеры его героев, выбрал лучших из лучших актеров, которые будто бы были рождены для ролей в этом фильме. В картине полностью отсутствует неразбериха и сумбурность, которая иногда присуща картинам подобного жанра при условии неправильно подобранных актеров. Здесь у каждого героя есть свой образ, свой характер… Своя судьба. Морган Фриман и Тим Роббинс создали, пожалуй, лучший экранный дуэт, каждый отразив что-то свое в своих героях. Они сумели воплотить в своих образах Жизнь. Более жестокую и опасную. Которая, впрочем, также требует силы воли, хладнокровности и жестокой расчетливости. Энди лишили свободы за преступление… Преступление, которое он не совершал. И стоит задать вопрос, так кто же после такого может считаться нарушителем закона?', Оценка =NEUTRAL
